{
  "schema": "ssw.mandate.v1",
  "mandate_id": "12121212-1212-4121-8121-121212121212",
  "version": 1,
  "created_at": "2026-09-19T12:00:00Z",
  "valid_from": "2026-09-19T12:00:00Z",
  "valid_until": "2026-10-19T12:00:00Z",
  "principal": {
    "holder_did": "did:soul:holder-alice",
    "sera_agent_did": "did:soul:agent:sera-alice"
  },
  "authority": {
    "class": "A3",
    "delegation_type": "bounded",
    "self_renewal_allowed": false
  },
  "scope": {
    "capabilities": [
      "payment"
    ],
    "action_types": [
      "payment.send"
    ],
    "assets": [
      {
        "asset_id": "USDC"
      }
    ],
    "chains": [
      {
        "chain_id": "eip155:137"
      }
    ],
    "counterparties": [
      {
        "canonical_id": "did:soul:merchant-example"
      }
    ],
    "contracts": []
  },
  "limits": {
    "per_action": {
      "USDC": {
        "max_atomic": "10000000"
      }
    }
  },
  "conditions": [],
  "risk": {
    "max_class": "R3",
    "prohibited_reasons": [
      "SUSPICIOUS_ASSET"
    ]
  },
  "device_policy": {
    "allowed_device_ids": [
      "device:phone-001"
    ],
    "allowed_device_states": [
      "TRUSTED"
    ],
    "allowed_runtime_ids": [
      "sera-runtime:phone-001"
    ],
    "cloud_execution_allowed": false,
    "wearable_execution_allowed": false
  },
  "trust": {
    "trust_protocol_required": true,
    "rev_required": true,
    "aurion_required": false
  },
  "authentication": {
    "creation_auth_ref": "auth:1",
    "per_action_auth_required": false,
    "step_up_rules": []
  },
  "presentation": {
    "holder_notification_required": true,
    "concealed_detail_policy": "inherit"
  },
  "revocation": {
    "status": "ACTIVE",
    "revoked_at": null,
    "revocation_reason": null
  },
  "usage": {
    "action_count": 0,
    "cumulative_values": {},
    "last_used_at": null
  },
  "evidence": {
    "sael_correlation_id": "34343434-3434-4343-8343-343434343434",
    "creation_evidence_ref": "sael:mandate:1"
  },
  "integrity": {
    "mandate_terms_hash": "sha256:bbbbbbbbbbbbbbbbbbbbbbbbbbbbbbbbbbbbbbbbbbbbbbbbbbbbbbbbbbbbbbbb",
    "holder_signature_ref": "signature:holder:1"
  }
}
